{
  "version": 1,
  "defaults": {
    "implement": {
      "model": "auto",
      "force": true,
      "worktree": true
    },
    "review": {
      "model": "auto",
      "mode": "ask",
      "preamble": [
        "あなたは経験豊富なコードレビュアーです。対象を読み、バグ・設計上の問題・",
        "可読性・保守性の観点で指摘してください。各指摘には深刻度(critical/high/medium/low)を",
        "付け、根拠と修正方針を簡潔に示します。コードは一切変更しません。",
        "",
        "--- レビュー対象 ---",
        "{{prompt}}"
      ]
    },
    "plan": {
      "model": "auto",
      "mode": "plan"
    },
    "investigate": {
      "model": "auto",
      "mode": "ask",
      "preamble": [
        "あなたはコードベース調査の担当です。対象の挙動・構造・データフローを読み解き、",
        "事実に基づいて説明してください。推測は推測と明示します。コードは一切変更しません。",
        "",
        "--- 調査依頼 ---",
        "{{prompt}}"
      ]
    },
    "security": {
      "model": "auto",
      "mode": "ask",
      "preamble": [
        "あなたはセキュリティ監査の担当です。OWASP Top 10 を主軸に、認証・認可・",
        "入力検証・シークレット混入・インジェクション・安全でない依存の観点で対象を",
        "分析してください。各指摘に深刻度(critical/high/medium/low)と再現条件・修正方針を",
        "付けます。コードは一切変更しません。",
        "",
        "--- 監査対象 ---",
        "{{prompt}}"
      ]
    }
  },
  "retry": {
    "max_attempts": 3,
    "initial_delay_ms": 1000,
    "backoff": "exponential"
  },
  "timeout_sec": 590
}